{
  "schema_version": "0.1.0",
  "id": "scenario-segment-0",
  "revision_id": "scenario-segment-0-r1",
  "spatial_assessment": {
    "id": "scenario-assessment",
    "revision_id": "scenario-assessment-r1"
  },
  "canonical_track": {
    "id": "scenario-track",
    "revision_id": "scenario-track-r1"
  },
  "ordinal": 0,
  "spatial_reference": "OGC:CRS84",
  "start_position": {
    "part_index": 0,
    "observation_index": 0,
    "fraction_to_next": 0.5
  },
  "end_position": {
    "part_index": 0,
    "observation_index": 1,
    "fraction_to_next": 0.5
  },
  "geometry": {
    "type": "LineString",
    "coordinates": [
      [
        112.9,
        28.205
      ],
      [
        112.905,
        28.205
      ],
      [
        112.91,
        28.205
      ]
    ]
  }
}
