{
  "schema_version": "0.1.0",
  "id": "fully-inside-segment-0",
  "revision_id": "fully-inside-segment-0-r1",
  "spatial_assessment": {
    "id": "fully-inside-assessment",
    "revision_id": "fully-inside-assessment-r1"
  },
  "canonical_track": {
    "id": "fully-inside-track",
    "revision_id": "fully-inside-track-r1"
  },
  "ordinal": 0,
  "spatial_reference": "OGC:CRS84",
  "start_position": {
    "part_index": 0,
    "observation_index": 0,
    "fraction_to_next": 0
  },
  "end_position": {
    "part_index": 0,
    "observation_index": 2,
    "fraction_to_next": 0
  },
  "geometry": {
    "type": "LineString",
    "coordinates": [
      [
        112.25,
        28.25
      ],
      [
        112.5,
        28.5
      ],
      [
        112.75,
        28.75
      ]
    ]
  }
}
