{
  "schema_version": "0.1.0",
  "id": "multipolygon-segment-1",
  "revision_id": "multipolygon-segment-1-r1",
  "spatial_assessment": {
    "id": "multipolygon-assessment",
    "revision_id": "multipolygon-assessment-r1"
  },
  "canonical_track": {
    "id": "multipolygon-track",
    "revision_id": "multipolygon-track-r1"
  },
  "ordinal": 1,
  "spatial_reference": "OGC:CRS84",
  "start_position": {
    "part_index": 0,
    "observation_index": 2,
    "fraction_to_next": 0.5
  },
  "end_position": {
    "part_index": 0,
    "observation_index": 3,
    "fraction_to_next": 0.5
  },
  "geometry": {
    "type": "LineString",
    "coordinates": [
      [
        114,
        28.5
      ],
      [
        114.5,
        28.5
      ],
      [
        115,
        28.5
      ]
    ]
  }
}
