{
  "schema_version": "0.1.0",
  "id": "starts-inside-leaves-segment-0",
  "revision_id": "starts-inside-leaves-segment-0-r1",
  "spatial_assessment": {
    "id": "starts-inside-leaves-assessment",
    "revision_id": "starts-inside-leaves-assessment-r1"
  },
  "canonical_track": {
    "id": "starts-inside-leaves-track",
    "revision_id": "starts-inside-leaves-track-r1"
  },
  "ordinal": 0,
  "spatial_reference": "OGC:CRS84",
  "start_position": {
    "part_index": 0,
    "observation_index": 0,
    "fraction_to_next": 0
  },
  "end_position": {
    "part_index": 0,
    "observation_index": 0,
    "fraction_to_next": 0.5
  },
  "geometry": {
    "type": "LineString",
    "coordinates": [
      [
        112.5,
        28.5
      ],
      [
        113,
        28.5
      ]
    ]
  }
}
