{
  "schema_version": "0.1.0",
  "id": "boundary-overlap-segment-0",
  "revision_id": "boundary-overlap-segment-0-r1",
  "spatial_assessment": {
    "id": "boundary-overlap-assessment",
    "revision_id": "boundary-overlap-assessment-r1"
  },
  "canonical_track": {
    "id": "boundary-overlap-track",
    "revision_id": "boundary-overlap-track-r1"
  },
  "ordinal": 0,
  "spatial_reference": "OGC:CRS84",
  "start_position": {
    "part_index": 0,
    "observation_index": 1,
    "fraction_to_next": 0
  },
  "end_position": {
    "part_index": 0,
    "observation_index": 2,
    "fraction_to_next": 0
  },
  "geometry": {
    "type": "LineString",
    "coordinates": [
      [
        112,
        28
      ],
      [
        113,
        28
      ]
    ]
  }
}
